"id","text","summary"
"20","Fresh blow for Liverpool woman facing 'deadly' deportation next week  Fatou Tamba is set to be deported to The Gambia within days, where her family say her life will be in danger  Fatou Tamba is facing deportation from the UK  A Liverpool woman who is facing imminent deportation to a country where her family fear she could be killed has faced a fresh blow in her fight for freedom.  Today the ECHO revealed that Fatou Tamba, who has lived in the UK for the past 17 years - with eight of them spent in Liverpool - is set to be deported to her native country of The Gambia in days after being detained by immigration officials. Her family fear she will be persecuted in The Gambia and that her life will be in danger.  ‌    Ms Tamba, 55, was living off Smithdown Road before she was detained by immigration officials last month. She has spent the last few weeks at Derwentside Immigration Removal Centre in the North East ahead of an expected deportation on Tuesday of next week.  Today, Ms Tamba's family were hoping that she would be released on immigration bail so that she could work on her case against deportation with her legal team and spend time with her family - including her partner and son, who are based in the UK.  But her brother Lamine, also based in the UK, has today confirmed to the ECHO that the application for immigration bail has been turned down, so she must remain at the immigration centre, where her family say she is 'distressed' and claim she has not received appropriate medical care for her diabetes condition.  Article continues below  Mr Tamba told the ECHO: ""Her application was rejected despite never having a history of absconding, having no criminal record and being of no danger to the public. It was not nice at all. We hope there will be a way (to stop the deportation) before Tuesday despite the two bank holidays.""  Fatou Tamba is set to be deported to The Gambia after living in the UK for 17 years  Ms Tamba first arrived in the UK from The Gambia, in West Africa as a visitor to her brother Lamine, who has British citizenship. But she did not feel she could return to the country as a change of ruling party had made life dangerous for her and her family.  ‌    She has lived in the UK for 18 years, with many of those years spent in Liverpool. She has become a prominent figure in the city's refugee and asylum seeker community, working with different community groups to support women arriving in the region.  Having remained in the UK, she had asylum applications rejected but was recently trying again to achieve the right to stay in the country, on the basis that she has built a family life here with her son, partner and community. She has most recently been living in the Smithdown Road area before her detention.  Lamine explained the dangers the family fear his sister could face if sent back to The Gambia next week. He told the ECHO: ""Most of our family is associated with the former government in The Gambia and this has resulted in us being targeted. Members of our family have been detained for years without charges and our cousin was shot. Many have had to flee and we still receive death threats.  ‌    ""Fatou is very worried about what could happen to her if she is sent back. She is very scared right now and in real mental distress. This will not be a safe place for her. People connected to the current [Gambian] government have made it clear that we will not return alive if we set foot in The Gambia. If she is sent back, she will be at risk of kidnapping, false imprisonment, or death.”  He added: ""Fatou is not only my sister but a mother, a partner, an auntie, and a cherished member of our community. She has built her life here, and she is loved and respected by many.  ""We are pleading for compassion and justice so Fatou can regularise her status. She is a kind, compassionate woman who wants nothing more than to live safely, contribute to society, and be with her family and partner.”  Article continues below  Kitty Worthing, who is a GP in Liverpool, said: ""We cannot talk about deportation without death. Detention and deportation are violent, deadly practices. As community members, healthcare workers, activists, friends and family members, we are doing everything we can to keep Fatou safe.""  The Home Office said its longstanding policy is not to comment on individual cases. A petition calling for the deportation plan to be stopped has been launched and can be found here.","Anil"
"21","Sydney will host Newcastle Jets at the Allianz Stadium on Saturday in another round of the 2024-25 Australia A-League campaign. The home side have had mixed results in the league of late and will need to be more consistent in the final games of the regular season if they are to secure a spot in the playoffs.  Ad  They played out a 2-2 draw against league leaders Auckland in their last league outing, squandering a two-goal lead handed to them by Adrian Segecic before crashing out of the AFC Champions League Two on Tuesday following a 2-1 aggregate defeat to Singaporean side Lion City Sailors.  Newcastle Jets, meanwhile, remain hopeful of securing playoff football, although that now looks too little, too late. They enjoyed an emphatic return to winning ways last time out as they thrashed 10-man Central Coast Mariners 6-0 on home turf, featuring goals from four different players, including Eli Adam,s who netted a brace.  Ad  Trending  The visitors sit ninth in the league standings with 29 points and cannot afford to drop any more points if they are to finish in the top six at the end of the regular season.  Sydney vs Newcastle Jets Head-to-Head and Key Numbers  There have been 57 meetings between Sydney and Newcastle. The hosts have won 32 of those games while the visitors have won just 11 times.  There have been 14 draws between the two teams, including their most recent matchup, which ended 2-2.  The visitors are without a clean sheet in their last five games in this fixture.  Sydney have scored 49 goals in the Australian top flight this season. Only Western United (50) and Western Sydney Wanderers (52) have managed more.  Ad  Sydney vs Newcastle Jets Prediction  The Sky Blues' latest result ended a run of back-to-back winless outings and they will be looking to kick on from that this weekend. They have lost just one of their last eight home games and will head into this one as favorites.  The Jets also saw their latest result snap a three-game winless run, and they will be keen to build on that here. They are, however, winless on their last four trips to the Allianz Stadium and could lose this one.  Ad  Prediction: Sydney 2-1 Newcastle Jets  Sydney vs Newcastle Jets Betting Tips  Tip 1 - Result: Sydney to win  Tip 2 - Goals - Over/under 2.5 - Over 2.5 goals (Eight of the visitors' last 10 matches have produced more than 2.5 goals)  Tip 3 - Both teams to score: YES (Both sides have found the back of the net in five of the hosts' last seven matches)  × Feedback Why did you not like this content? Clickbait / Misleading  Factually Incorrect  Hateful or Abusive  Baseless Opinion  Too Many Ads  Other Cancel Submit Was this article helpful? Thank You for feedback  About the author Soyoye Jedidiah Jedidiah is a European and international football journalist at Sportskeeda, who has been covering match previews for more than 3 years. Currently pursuing an engineering degree from the University of Ibadan, he conducts thorough research and ensures to be up-to-date with football news across the globe to create the most accurate previews.    A Manchester United fan, Jedidiah fell in love with football and the Red Devils since their UEFA Champions League triumph over Chelsea in 2008. He is a big fan of Robert Lewandowski and his historic performances from 2020, but feels that only Erling Haaland and Kylian Mbappe are capable of replicating the Lionel Messi and Cristiano Ronaldo rivalry. His all-time favorite manager is Carlo Ancelotti due to the Italian's remarkable composure in difficult moments of a contest. Spain's 1-0 win over Netherlands in the final of the 2010 FIFA World Cup is etched in his memory forever.    A true student of the game, Jedidiah relishes identifying hidden gems from lower-tiered leagues such as the EFL Championship and the Eredivisie. When not creating previews, he likes playing football and reading books. Know More","Anil"
"22","","Anil"
"23","She added: “I am disappointed that, by rejecting my recommendation to offer her the next suitable property it has available, the council is failing to fully accept the gravity its incorrect advice and practice has had on this woman and her child.","Anil"
"24","El contexto del italiano en el Madrid ilusiona. El sueño, contar con él antes de junio, de cara al parón. Se esperan contactos porque la CBF niega haber enviado un emisario.  El río suele llevar agua cuando suena. Y en lo referente a Brasil y Ancelotti es el Amazonas. Carletto es el sueño de la CBF. Lo era, antes de que el Madrid extendiera su contrato hasta 2026 la temporada pasada, y lo sigue siendo. Para reconducir a la Seleção. Sin rumbo... y sin entrenador tras la destitución de Dorival Júnior. El ramillete de opciones fluctúa, con Jorge Jesus o con la aparición de Jürgen Klopp en las últimas fechas, pero el favorito no cambia: Carlo Ancelotti. Y el contexto que vive el de Reggiolo dispara la ilusión. Brasil vuelve a por el italiano y lo hace con fuerza.  Porque Ancelotti nunca ha salido del radar de Brasil. Es el gran deseado de Ednaldo Rodrigues, presidente de la federación. No le olvida a pesar de todas sus negativas. Tras la destitución de Dorival Junior el mes pasado, la CBF volvió a colocar al técnico en lo más alto de su lista. Si bien han mantenido conversaciones con su entorno, según pudo saber AS de fuentes muy cercanas la institución, la CBF no mandó ningún emisario a Madrid para negociar con el técnico, incluso desde el seno de la institución mostraron sorpresa al conocer la noticia. Hasta el punto de haber publicado un comunicado para atemperar el runrún: “La CBF niega haber enviado un emisario a Madrid. El asunto lo tratan únicamente el coordinador general ejecutivo de las Selecciones Masculinas, Rodrigo Caetano, y el presidente Ednaldo Rodrigues. Ambos están en Río de Janeiro”.  Brasil enfrió la carpeta de Carletto tras el último sondeo. Según avanzaron desde Brasil y pudo confirmar este diario, Jorge Jesus estaba destinado a ser el nuevo técnico, a falta de oficialidad. Estaba porque la potencial salida del italiano del Bernabéu paraliza toda negociación con el luso. Si Ancelotti sale al mercado, Brasil quiere esperarle, con unas condiciones contractuales similares a las apalabradas en 2023, pero tienen una fecha límite. La Canarinha quiere tener a su nuevo técnico de cara al parón de junio, para los enfrentamientos ante Ecuador (3/6) y Paraguay (8/6). Hasta finales de abril no se espera que hayan actualizaciones al respecto. Aunque, eso sí, si el italiano se pusiera al frente de la verdeamarela, Davide Ancelotti tomaría otro camino.  Mientras tanto, la postura de Carletto es cristalina. “Mi contrato es bastante claro, me queda otro año... pero lo que sea, se hablará a final de la temporada; el club siempre me apoya, sobre todo en los momentos de dificultad”. Sin dobleces, así se mostraba antes de confirmarse el varapalo contra el Arsenal. Un sentencia que ha repetido en varias ocasiones. En resumen: quiere cumplir su contrato. Solo dará un paso al lado si se lo piden. “No puedo hablar de eso ahora”, respondió sobre sus opciones de dirigir al Madrid en el Mundial de Clubes. Y añadió: “Puede pasar, no lo sé. El club puede querer cambiar. Puede ser este año, puede ser el próximo. No hay problema”. Ese “el club puede querer cambiar” es la clave. Si por Carletto fuera, no habría discusión. “¿Mi futuro? No lo sé y no lo quiero saber”.  Aunque, algo también cristalino, no tiene intención de terminar su etapa con tiranteces. “El día que termine aquí sólo puedo hacer una cosa: dar las gracias. En un día, en un mes, en un año. Daré las gracias a este club, nada más”. Agradecimiento. Porque el técnico más laureado de la historia del Madrid (15 títulos) estaría encantado de seguir ligado a la entidad. De momento.  Brasil inicia la era post-Neymar  La CBF quiere dar un golpe sobre la mesa de cara al próximo Mundial de 2026. La dura goleada ante Argentina rompió algo dentro de la institución. Brasil quiere volver a ser fuerte y para ello necesitan empezar de cero. La llegada de Ancelotti daría un impulso a una plantilla que ya le conoce. Hay un total convencimiento para que Vinicius y Rodrygo asuman el liderazgo de la Pentacampeona. Quieren dejar atrás el legado de Neymar, eternamente agradecidos a todo lo que ha aportado, pero con la certeza de que es la mejor opción para lo que viene.  Tanto Jorge Jesus como Ancelotti deberán hacer un trabajo similar al realizado por Luis Aragonés en la Roja con otra figura como Raúl. No será sencillo. Neymar aún tiene tiempo para revertir su situación y hacer el último gran servicio para la Canarinha. Pero la idea es clara, la era post-Ney arrancará el próximo mes de junio.  Noticias relacionadas  ¡Tus opiniones importan! Comenta en los artículos y suscríbete gratis a nuestra newsletter y a las alertas informativas en la App o el canal de WhatsApp.  ¿Buscas licenciar contenido? Haz clic aquí","Anil"
"25","En cliquant sur ""Tout Accepter"" vous consentez au traitement par ANO « TV-Novosti » de certaines données personnelles stockées sur votre terminal (telles que les adresses IP, les données de navigation, les données d'utilisation ou de géolocalisation ou bien encore les interactions avec les réseaux sociaux ainsi que les données nécessaires pour pouvoir utiliser les espaces commentaires de notre service). En cliquant sur ""Tout Refuser"", seuls les cookies/traceurs techniques (strictement limités au fonctionnement du site ou à la mesure d’audiences) seront déposés et lus sur votre terminal. ""Tout Refuser"" ne vous permet pas d’activer l’option commentaires de nos services. Pour activer l’option vous permettant de laisser des commentaires sur notre service, veuillez accepter le dépôt des cookies/traceurs « réseaux sociaux », soit en cliquant sur « Tout accepter », soit via la rubrique «Paramétrer vos choix». Le bandeau de couleur indique si le dépôt de cookies et la création de profils sont autorisés (vert) ou refusés (rouge). Vous pouvez modifier vos choix via la rubrique «Paramétrer vos choix». Réseaux sociaux Désactiver cette option empêchera les réseaux sociaux de suivre votre navigation sur notre site et ne permettra pas de laisser des commentaires.","Anil"
