"id","text","summary"
"9","La Fiscalía de Tecate lidera campañas de prevención en el entorno estudiantil. (FGE Tecate)  En un esfuerzo por consolidar la seguridad y la prevención en las comunidades escolares, la Fiscalía Regional de Tecate, en colaboración con diversas instituciones, llevó a cabo una jornada de trabajo en la Preparatoria No. 25 del CECyTE  Esta actividad se enmarcó dentro de la Jornada Nacional de Prevención contra las Adicciones y tuvo como objetivo principal establecer un diálogo cercano con estudiantes y docentes, además de implementar medidas preventivas en el entorno educativo.  Según informó la Fiscalía General del Estado de Baja California, estas acciones buscan fortalecer la confianza de los jóvenes hacia las autoridades y fomentar entornos escolares más seguros.  Una jornada educativa especial  SEDENA y Seguridad Municipal participan en actividades contra el consumo de sustancias. (FGE Tecate)  De acuerdo con la información publicada por la Fiscalía, la actividad fue liderada por el fiscal regional de Tecate, Genaro Adrián Guzmán García, quien destacó la importancia de generar espacios de interacción directa con los estudiantes.  Durante la jornada, se presentaron los servicios de atención, orientación y seguimiento que la Fiscalía pone a disposición de la comunidad, con el propósito de atender las necesidades de los jóvenes y sus familias en temas relacionados con la seguridad y la prevención de adicciones.  Uno de los momentos destacados de la jornada fue la participación del binomio canino K9 “Maya”, que acompañó al equipo de la Fiscalía en un recorrido por las aulas del plantel.  Según detalló la institución, la presencia de este binomio no sólo permitió hacer revisiones preventivas, sino que también ayudó a establecer un vínculo de confianza entre los estudiantes y las autoridades.  La interacción con “Maya” fue clave para reforzar el mensaje de prevención y seguridad, además de sensibilizar a los jóvenes sobre los riesgos asociados al consumo de sustancias adictivas.  La Fiscalía subrayó que estas acciones forman parte de un enfoque integral que busca combatir las adicciones desde una perspectiva preventiva, involucrando tanto a los estudiantes como al personal docente en la construcción de un entorno escolar más seguro y saludable.  Colaboración para fortalecer la seguridad  Estudiantes interactúan con el binomio canino “Maya” en jornada de sensibilización. (FGE Tecate)  La jornada contó con la participación de otras instituciones clave en materia de seguridad y prevención. Según informó la Fiscalía, se trabajó en coordinación con la Dirección de Seguridad y Tránsito Municipal de Tecate y con elementos de la Secretaría de la Defensa Nacional (SEDENA).  Esta colaboración interinstitucional permitió sumar esfuerzos para abordar de manera conjunta los desafíos relacionados con la prevención de adicciones y la seguridad en el municipio.  La Fiscalía destacó que esta alianza estratégica con otras dependencias refuerza el compromiso de las autoridades de Tecate con la ciudadanía, especialmente con las nuevas generaciones. La participación de la SEDENA y la Dirección de Seguridad y Tránsito Municipal fue fundamental para garantizar el éxito de las actividades realizadas en la Preparatoria No. 25 del CECyTE.  Según informó la institución, la prevención es un eje clave en la construcción de comunidades más seguras, informadas y participativas. En este sentido, las acciones realizadas en Tecate forman parte de una estrategia más amplia que busca atender las necesidades de los jóvenes y promover su bienestar integral.  La Fiscalía enfatizó que estas actividades no sólo tienen como objetivo prevenir el consumo de sustancias adictivas, sino también fomentar una cultura de confianza y colaboración entre las autoridades y la comunidad estudiantil. Con este enfoque se busca empoderar a los jóvenes para que se conviertan en agentes de cambio dentro de sus comunidades, contribuyendo así a la construcción de un entorno más seguro y saludable para todos.  La jornada realizada en la Preparatoria No. 25 del CECyTE representa un modelo de intervención que podría replicarse en otras comunidades escolares de Baja California.  Según destacó la Fiscalía, este tipo de iniciativas son fundamentales para abordar de manera preventiva los problemas asociados al consumo de sustancias adictivas, especialmente entre los jóvenes.  La institución reiteró su compromiso de continuar trabajando en estrecha colaboración con otras dependencias y con la comunidad en general para fortalecer las acciones de prevención y seguridad en el estado. Además, hizo un llamado a las familias, docentes y estudiantes a sumarse a estos esfuerzos, reconociendo que la prevención es una tarea compartida que requiere la participación activa de todos los sectores de la sociedad.","Anil"
"10","The overdue vessel is a four-and-a-half-metre Hewes recreational boat registered in Washington state as WN 8608CZ. (U.S. Coast Guard)","Anil"
"11","Cenzurați, lipsiți de subvenții și reduși la tăcere, zeci de oameni de știință americani se gândesc să-și continue munca în afara țării, după deciziile președintelui Donald Trump. Pe 6 martie, facultatea Aix-Marseille a lansat un apel “Safe place for science”/ ""Un loc sigur pentru știință"" și a invitat cercetători americani să vină să lucreze în Franța.  Publicitate Citiți continuarea  În mai puțin de o lună, Universitatea Aix-Marsilia a primit mai bine de 300 de candidaturi din partea unor cercetători americani. “Am fost imediat copleșiți”, recunoaște Eric Berton, este președintele acestei Universități și cel care a inițiat proiectul.  Responsabilul din Marsilia explică faptul că “mulți cercetători au aplicat la programul oferit de Universitatea Aix-Marsilia deoarece, în Statele Unite le sunt îngreunate proiectele pentru dezvoltarea de ARN, cercetările privitoare la chestiuni de epidemiologie ori de oncologie. Ceea ce se întâmplă în SUA acum influențează deja știința globală. Când ștergem bazele de date de mediu asta pune în pericol predictibilitatea evenimentelor meteorologice potențial periculoase"", spune Eric Berton.  Universitatea poate să primească undeva între 15 și 20 de oameni de știință americani, timp de 3 ani.  Situația fiecăruia va fi studiată foarte atent înainte ca dosarele să fie acceptate, explică președintele Universității Aix-Marsilia. Pentru a-i selecționa, universitatea se va axa pe mai multe criterii: se va verifica dacă le este, într-adevăr împiedicată munca lor de cercetare, dacă specialitatea lor mai beneficiază de finanțare americană etc .  Cei mai puțin entuziasmați sunt sindicaliștii locali, care, scrâșnesc din dinți când privesc bugetul destinat acestor cercetători americani: 15 milioane de euro.  Bruno Pouvelle reprezintă sindicatul CGT – Confederația Generală a Muncii- iar pentru el bugetul este foarte bun dar e uimitor cum a fost deblocat dat fiind că are mulți colegi francezi care dau din coate pentru a-și finanța propriile proiecte de cercetare.  Primii oameni de știință ametricani sunt așteptați la Marsilia începând cu luna iunie.  În Europa, numeroase parteneriate de cercetare încheiate cu instituții americane se regăsesc sub un mare semn de întrebare, sub administrația Donald Trump. La începutul acestei luni, aproape 2.000 de cercetători din Statele Unite au lansat un “SOS” pentru salvarea științei, ca răspuns la atacurile lui Donald Trump asupra lumii academice. Laboratoare întregi au fost închise, s-au făcut concedieri în masă, domenii întregi de cercetare au trecut sub controlul guvernamental american.  Casa Albă se gândește, pur și simplu, să închidă centrul de cercetare a Administraţiei Naţionale Oceanice şi Atmosferice (NOAA), un centrul mondial de referință. Executivul american intenţionează să solicite Congresului - care trebuie să aprobe bugetele alocate diferitelor agenţii federale - să taie fondurile laboratoarelor de cercetare şi birourilor responsabile cu studiul schimbării climatice în această prestigioasă agenţie, potrivit unui document intern al Casei Albe consultat de mai multe publicații americane și care scriu că circa 75% dintre finanţările pentru cercetare ar putea fi eliminate din bugetul pe anul 2026.","Anil"
"12","","Anil"
"13","NFL Draft analyst for 'The Athletic' Dane Brugler believes that the New York Jets will select a tight end in the second round of the 2025 NFL Draft in order to help out their new QB Justin Fields.  Ad  In his recent seven round 2025 NFL mock draft released on Wednesday, Brugler predicted that the Jets would select LSU Tigers tight end Mason Taylor with the No. 42 overall pick later this April.  The Jets current tight end depth chart features Jeremy Ruckert, Stone Smartt, Zack Kuntz, and Neal Johnson after the departure of TE Tyler Conklin to the Los Angeles Chargers via free agency this offseason. Though all of the individuals listed are capable NFL players, none are truly elite receiving options for the Jets and Fields.  Ad  Trending  70% Win (110-25-1) 70% Win (110-25-1) 70% Win (110-25-1) Unlock Free tips from our Experts Get Picks Now  As a result, the tight end position is definitely a position where the Jets need to focus some draft capital on this year. Taylor could be a smart option for the iconic New York franchise as he will likely not cost the team a first round pick, yet he is still extremely talented and has the abilities to make an instant impact at the NFL level.  Looking to predict NFL playoff Scenarios? Try our NFL Playoff Predictor for real-time simulations and stay ahead of the game!  For LSU in 2024, Taylor had 55 receptions for 546 receiving yards and two receiving touchdowns. He is a sharp route runner who also has strong hands and is able to generate yards after the catch with the football as well.  Ad  Can Mason Taylor help the New York Jets?  Taylor can help the Jets and new QB Justin Fields in 2025. The offense already has wide receiver Garrett Wilson and running back Breece Hall, however, the unit does not have a clear tight end option who can help in the receiving game. Taylor can instantly make the Jets one of the most well-balanced offensive units in the league, one that features both solid rushing and receiving options.  Bleacher Report gave Taylor a grade of 7.5, something that in their opinion, translates to a third round pick in the 2025 NFL Draft and a ""high-level backup/potential starter"" in the NFL in the future. Taylor's National Football League player comparison was Green Bay Packers tight end Tucker Kraft.  × Feedback Why did you not like this content? Clickbait / Misleading  Factually Incorrect  Hateful or Abusive  Baseless Opinion  Too Many Ads  Other Cancel Submit Was this article helpful? Thank You for feedback  About the author Joshua Gillesby Joshua Gillesby is a College Sports journalist at Sportskeeda who graduated from McMaster University with a Bachelor's in Arts & Science.    Josh is based in Ontario, Canada and his favorite college team is the Notre Dame Fighting Irish, due in large part to his former hockey team being invited for a tour of the facilities and watching a game while there.    His favorite past college football player is Joe Burrow, as his 2019 season was incredible and a major reason behind LSU's playoff success and National Championship.    Outside of work, Josh enjoys traveling, reading, writing, and science. Know More  LA Chargers Nation! Check out the latest Chargers Schedule and dive into the Los Angeles Chargers Depth Chart for NFL Season 2024-25.","Anil"
"14","Le député (ex-RN) de l'Yonne, Daniel Grenon, était jugé jeudi par le tribunal correctionnel de Sens, dans l'Yonne, pour des faits d'injure publique et provocation à la discrimination, commis le 2 juillet 2024, lors d'un débat durant les législatives organisé par l'Yonne Républicaine.  C'est devant une salle comble, au tribunal judiciaire de Sens, que le député de l'Yonne, Daniel Grenon (ex-RN) vient à la barre. Les explications du député de 78 ans sont attendues par le tribunal ainsi que par une cinquantaine de militants anti-racistes venus assister à ce procès. ""Sur 30 ou 40 postes, on ne peut pas se permettre d’avoir des binationaux. Des Maghrébins sont arrivés au pouvoir, ministre et cætera, ces gens-là n'ont pas leur place dans les hauts lieux."" Voilà l'objet des poursuites contre celui qui était député sortant et candidat aux législatives au moment des faits. Un extrait d'environ deux minutes du débat est diffusé à l'ensemble de la salle.  Devant le tribunal, le député assume ses propos  Face à ses propres paroles, Daniel Grenon tente de s'expliquer d'une voix faible, ayant à plusieurs reprises des difficultés à comprendre les questions de la présidente du tribunal. Et plutôt que de nier cette volonté de discrimination, le député la justifie. ""si on commence à mettre des gens dans des endroits où ils n'ont pas leur place. La France devient quoi ?"" interroge le député pour qui les binationaux risquent à tout moment d'être déloyaux à la nation.  Une cinquantaine de militants anti-racistes étaient rassemblés devant les grilles du palais de justice de Sens jeudi 17 avril 2025 © Radio France - Renaud Candelier  ""Du racisme pur et simple"" - l'avocate de la Ligue des Droits de l'Homme  Mais ""on peut être déloyal par intérêt financier, idéologique ou amoureux"", corrige l'avocat du MRAP. ""Là, on est dans une discrimination fondée sur les origines"" estime la procureure, ""sans d'autre explication que la peur qui n'est fondée sur rien"". Concernant son allusion aux Maghrébins binationaux, le député affirme qu'il a été piégé lors du débat : ""le journaliste m'a emmené vers les Maghrébins, il m'a emmené pour me planter. Il a réussi ce qu'il a voulu."" Des accusations graves contre le journal l'Yonne Républicaine mais que les faits démentent puisqu'il s'agissait d'une simple question posée au député lors d'un débat. ""Monsieur Grenon a l'habitude de parler face à des députés et des journalistes. Il sait qu'il peut ne pas répondre à une question"", précise d'ailleurs l'avocate de la Ligue des droits de l'homme. Elle considère surtout que ""faire peur, parler de danger, c'est une incitation au rejet, voire à l'action contre les binationaux. Ce discours est du racisme pur et simple avec l'apparence d'un propos policé"".  Une peine d'amende requise  La défense de Daniel Grenon explique qu'il voulait simplement soutenir une idée politique portée de le président du RN. ""L'idée de monsieur Grenon est de vouloir discriminer légalement certaines personnes, dans la loi, des discriminations existent déjà"". L'avocat reconnaît pour autant la maladresse de son client. ""Mais qui mieux qu'un député devrait maitriser sa parole ?"" s'étonne la procureure. Elle considère que vouloir exclure les binationaux en raison de ce qu'ils sont est une injure et un appel à la discrimination. Le parquet requiert contre Daniel Grenon une peine de 1.500 euros d'amende. La décision a été mise en délibéré au 2 mai 2025.","Anil"
"15","Click to share on Facebook (Opens in new window)","Anil"
"16","'We can't bring in 13-14 players - that'd be too much change'  [Getty Images]  Mike Richards of the Unholy Trinity Everton Podcast believes the club might have to be ruthless with some of the players approaching the end of their contracts - but thinks some have to stay to prevent too much of a change.  Speaking to BBC Radio Merseyside, he said: ""I think it's going to be a transition this summer. The big issue is the number of players out of contract or loans ended - you can't let them all go.  ""That's where we are, we can't bring in 13-14 players - it can't and won't happen, that'd be too much change.  ""Some of those players out of contract, whether it be (Abdoulaye) Doucoure, Idrissa Gana Gueye, (Dominic) Calvert-Lewin - some of these will be offered new deals.  ""But I think Doucoure is Everton of the old and we need to look at Everton going forward in the future and that's getting a different number 10 - more technical, you look at Alcaraz - that for me is the kind of number 10 Everton need.  ""We need to move forward and become a better footballing side.""  Listen to more on BBC Sounds","Anil"
